Job_Title,Industry,Skills
AI Researcher,Entertainment,"Customer Relationship Management, Technical Writing, Budgeting, Critical Thinking, Coding"
AI Researcher,Energy,"System Architecture, System Architecture, Collaboration, Machine Learning, Machine Learning"
AI Researcher,Healthcare,"Process Optimization, Team Leadership, Customer Relationship Management, Adaptability, Networking"
AI Researcher,Manufacturing,"Adaptability, Employee Engagement, Change Management, Process Optimization, System Architecture"
AI Researcher,Telecommunications,"Financial Forecasting, Transportation Logistics, Stakeholder Management, Cloud Computing, Employee Engagement"
AI Researcher,Technology,"Regulatory Compliance, Risk Assessment, Change Management, Stakeholder Management, Product Roadmapping"
AI Researcher,Finance,"Product Roadmapping, Data Analysis, Budgeting, AI Development, Financial Forecasting"
AI Researcher,Education,"Collaboration, Process Optimization, Marketing Strategy, Statistical Modeling, Database Management"
AI Researcher,Retail,"Communication, Coding, Change Management, Budgeting, Media Planning"
AI Researcher,Transportation,"Regulatory Compliance, Product Roadmapping, Marketing Strategy, Stakeholder Management, Supply Chain Management"
Biomedical Engineer,Agriculture,"Creativity, Healthcare Compliance, Design Thinking, Critical Thinking, Technical Writing"
Biomedical Engineer,Tourism,"Adaptability, Customer Relationship Management, Team Leadership, Statistical Modeling, System Architecture"
Biomedical Engineer,Automotive,"Change Management, Sales Negotiation, Data Analysis, Conflict Resolution, Customer Relationship Management"
Biomedical Engineer,Aerospace,"Risk Assessment, Stakeholder Management, Budgeting, User Research, Stakeholder Management"
Biomedical Engineer,Fashion,"System Architecture, Supply Chain Management, Media Planning, AI Development, Energy Efficiency"
Biomedical Engineer,Nonprofit,"Collaboration, Database Management, Team Leadership, Supply Chain Management, Design Thinking"
Biomedical Engineer,Consulting,"Database Management, Product Roadmapping, Regulatory Compliance, Customer Relationship Management, Project Management"
Biomedical Engineer,Real Estate,"Team Leadership, Budgeting, Transportation Logistics, Design Thinking, Problem Solving"
Biomedical Engineer,Hospitality,"System Architecture, Adaptability, Creativity, Machine Learning, Cloud Computing"
Biomedical Engineer,Pharmaceutical,"AI Development, Data Visualization, Networking, Regulatory Compliance, Machine Learning"
Cybersecurity Analyst,Energy,"Supply Chain Management, Machine Learning, Public Speaking, Machine Learning, Process Optimization"
Cybersecurity Analyst,Education,"Energy Efficiency, Employee Engagement, Networking, Supply Chain Management, Sales Negotiation"
Cybersecurity Analyst,Finance,"Employee Engagement, Networking, SEO Optimization, Stakeholder Management, Healthcare Compliance"
Cybersecurity Analyst,Transportation,"Regulatory Compliance, System Architecture, Media Planning, Statistical Modeling, Media Planning"
Cybersecurity Analyst,Telecommunications,"Team Leadership, Supply Chain Management, System Architecture, Public Speaking, Quality Assurance"
Cybersecurity Analyst,Manufacturing,"Financial Forecasting, Supply Chain Management, Collaboration, Machine Learning, Coding"
Cybersecurity Analyst,Healthcare,"Communication, Supply Chain Management, Media Planning, Problem Solving, Communication"
Cybersecurity Analyst,Entertainment,"Stakeholder Management, Critical Thinking, Public Speaking, Adaptability, Critical Thinking"
Cybersecurity Analyst,Technology,"Transportation Logistics, Healthcare Compliance, Customer Relationship Management, Change Management, Content Creation"
Cybersecurity Analyst,Retail,"AI Development, Risk Assessment, Transportation Logistics, Budgeting, Supply Chain Management"
Data Scientist,Telecommunications,"Cybersecurity Protocols, Critical Thinking, Creativity, Networking, Stakeholder Management"
Data Scientist,Manufacturing,"Change Management, Content Creation, Process Optimization, Content Creation, Market Research"
Data Scientist,Healthcare,"SEO Optimization, Quality Assurance, Supply Chain Management, Product Roadmapping, Networking"
Data Scientist,Energy,"Financial Forecasting, Public Speaking, Risk Assessment, Conflict Resolution, Employee Engagement"
Data Scientist,Education,"Adaptability, AI Development, Problem Solving, Change Management, Communication"
Data Scientist,Retail,"Employee Engagement, Collaboration, Networking, Creativity, Conflict Resolution"
Data Scientist,Transportation,"Adaptability, Collaboration, Healthcare Compliance, Technical Writing, Critical Thinking"
Data Scientist,Technology,"Marketing Strategy, Sales Negotiation, Media Planning, Content Creation, Content Creation"
Data Scientist,Entertainment,"Product Roadmapping, Supply Chain Management, Market Research, Employee Engagement, Design Thinking"
Data Scientist,Finance,"Quality Assurance, Customer Relationship Management, Risk Assessment, Conflict Resolution, Employee Engagement"
Digital Content Creator,Real Estate,"Collaboration, Risk Assessment, Database Management, Critical Thinking, Budgeting"
Digital Content Creator,Consulting,"SEO Optimization, Transportation Logistics, Team Leadership, Networking, Employee Engagement"
Digital Content Creator,Nonprofit,"Sales Negotiation, Problem Solving, Data Visualization, Technical Writing, Supply Chain Management"
Digital Content Creator,Fashion,"Cloud Computing, Product Roadmapping, Regulatory Compliance, Energy Efficiency, Project Management"
Digital Content Creator,Aerospace,"Risk Assessment, Media Planning, Database Management, Data Analysis, Adaptability"
Digital Content Creator,Automotive,"Change Management, Budgeting, Budgeting, Quality Assurance, Regulatory Compliance"
Digital Content Creator,Hospitality,"Financial Forecasting, SEO Optimization, Conflict Resolution, Statistical Modeling, Communication"
Digital Content Creator,Tourism,"Customer Relationship Management, Sales Negotiation, User Research, Supply Chain Management, Technical Writing"
Digital Content Creator,Agriculture,"Change Management, Transportation Logistics, Coding, Regulatory Compliance, Employee Engagement"
Digital Content Creator,Pharmaceutical,"Networking, Cloud Computing, Machine Learning, Supply Chain Management, Risk Assessment"
Environmental Scientist,Tourism,"Change Management, Collaboration, Change Management, Financial Forecasting, Process Optimization"
Environmental Scientist,Pharmaceutical,"Energy Efficiency, Regulatory Compliance, Critical Thinking, Stakeholder Management, Coding"
Environmental Scientist,Automotive,"Transportation Logistics, Database Management, Statistical Modeling, Employee Engagement, Transportation Logistics"
Environmental Scientist,Aerospace,"Collaboration, Stakeholder Management, Data Visualization, Adaptability, Process Optimization"
Environmental Scientist,Fashion,"Healthcare Compliance, SEO Optimization, Machine Learning, AI Development, Collaboration"
Environmental Scientist,Nonprofit,"Supply Chain Management, Data Analysis, Transportation Logistics, Creativity, Energy Efficiency"
Environmental Scientist,Consulting,"Collaboration, Problem Solving, Risk Assessment, Budgeting, Collaboration"
Environmental Scientist,Real Estate,"Budgeting, Budgeting, Quality Assurance, Networking, Adaptability"
Environmental Scientist,Hospitality,"Content Creation, Healthcare Compliance, Statistical Modeling, Data Analysis, Machine Learning"
Environmental Scientist,Agriculture,"Customer Relationship Management, Energy Efficiency, Risk Assessment, Coding, Critical Thinking"
Event Planner,Pharmaceutical,"Adaptability, Team Leadership, Healthcare Compliance, Data Visualization, Cloud Computing"
Event Planner,Automotive,"Networking, Statistical Modeling, Market Research, Change Management, Risk Assessment"
Event Planner,Aerospace,"Product Roadmapping, Team Leadership, Transportation Logistics, Content Creation, Energy Efficiency"
Event Planner,Fashion,"Conflict Resolution, Public Speaking, Stakeholder Management, AI Development, Data Analysis"
Event Planner,Consulting,"SEO Optimization, Supply Chain Management, Process Optimization, Employee Engagement, Problem Solving"
Event Planner,Real Estate,"Networking, Energy Efficiency, Data Visualization, Project Management, Adaptability"
Event Planner,Agriculture,"Process Optimization, Risk Assessment, Change Management, Budgeting, Transportation Logistics"
Event Planner,Hospitality,"Problem Solving, Adaptability, Problem Solving, Healthcare Compliance, Market Research"
Event Planner,Tourism,"Financial Forecasting, Media Planning, Project Management, Communication, User Research"
Event Planner,Nonprofit,"Sales Negotiation, Database Management, System Architecture, Coding, Critical Thinking"
Financial Advisor,Tourism,"Design Thinking, Database Management, Database Management, AI Development, Database Management"
Financial Advisor,Real Estate,"Media Planning, Collaboration, AI Development, Data Analysis, Cloud Computing"
Financial Advisor,Pharmaceutical,"Budgeting, Quality Assurance, Problem Solving, Data Analysis, SEO Optimization"
Financial Advisor,Automotive,"Creativity, SEO Optimization, Media Planning, Communication, Media Planning"
Financial Advisor,Aerospace,"Transportation Logistics, Critical Thinking, Design Thinking, Technical Writing, Healthcare Compliance"
Financial Advisor,Fashion,"Media Planning, Supply Chain Management, Energy Efficiency, Risk Assessment, Collaboration"
Financial Advisor,Nonprofit,"Data Visualization, Collaboration, Problem Solving, Conflict Resolution, Project Management"
Financial Advisor,Consulting,"Team Leadership, Energy Efficiency, Public Speaking, Machine Learning, Design Thinking"
Financial Advisor,Agriculture,"Team Leadership, Technical Writing, Critical Thinking, Technical Writing, Product Roadmapping"
Financial Advisor,Hospitality,"Cloud Computing, Risk Assessment, Customer Relationship Management, User Research, Marketing Strategy"
Game Developer,Agriculture,"Content Creation, Media Planning, Data Analysis, Critical Thinking, System Architecture"
Game Developer,Pharmaceutical,"Supply Chain Management, Collaboration, Creativity, Sales Negotiation, Product Roadmapping"
Game Developer,Automotive,"Creativity, Creativity, Cloud Computing, Critical Thinking, Adaptability"
Game Developer,Aerospace,"Data Visualization, Machine Learning, Stakeholder Management, Technical Writing, Collaboration"
Game Developer,Fashion,"Stakeholder Management, Adaptability, Stakeholder Management, Change Management, User Research"
Game Developer,Nonprofit,"Data Analysis, Conflict Resolution, Conflict Resolution, Marketing Strategy, Cloud Computing"
Game Developer,Consulting,"Team Leadership, Financial Forecasting, Database Management, Change Management, Project Management"
Game Developer,Real Estate,"Change Management, Media Planning, Data Analysis, Data Visualization, Process Optimization"
Game Developer,Tourism,"Statistical Modeling, Quality Assurance, Marketing Strategy, Sales Negotiation, Public Speaking"
Game Developer,Hospitality,"Media Planning, Regulatory Compliance, Change Management, Supply Chain Management, Cloud Computing"
HR Manager,Education,"System Architecture, User Research, Content Creation, Cloud Computing, Cybersecurity Protocols"
HR Manager,Entertainment,"Statistical Modeling, Team Leadership, Conflict Resolution, Data Analysis, Adaptability"
HR Manager,Technology,"Healthcare Compliance, Creativity, Project Management, Cloud Computing, Cybersecurity Protocols"
HR Manager,Retail,"Problem Solving, Public Speaking, Process Optimization, Collaboration, Product Roadmapping"
HR Manager,Finance,"Quality Assurance, Supply Chain Management, Customer Relationship Management, Data Analysis, Coding"
HR Manager,Telecommunications,"Cloud Computing, Conflict Resolution, Sales Negotiation, Critical Thinking, SEO Optimization"
HR Manager,Manufacturing,"Employee Engagement, Communication, Critical Thinking, Project Management, Database Management"
HR Manager,Healthcare,"Statistical Modeling, Change Management, AI Development, Financial Forecasting, Energy Efficiency"
HR Manager,Energy,"Conflict Resolution, Process Optimization, Budgeting, Healthcare Compliance, Marketing Strategy"
HR Manager,Transportation,"Adaptability, Budgeting, Design Thinking, Adaptability, Process Optimization"
IT Support Specialist,Agriculture,"Media Planning, SEO Optimization, Energy Efficiency, Technical Writing, Financial Forecasting"
IT Support Specialist,Real Estate,"Data Analysis, Team Leadership, Coding, AI Development, Process Optimization"
IT Support Specialist,Consulting,"Statistical Modeling, Cybersecurity Protocols, Data Analysis, Adaptability, Regulatory Compliance"
IT Support Specialist,Nonprofit,"Cybersecurity Protocols, Communication, AI Development, Budgeting, Healthcare Compliance"
IT Support Specialist,Fashion,"Cloud Computing, Statistical Modeling, Creativity, Sales Negotiation, Adaptability"
IT Support Specialist,Aerospace,"Coding, Critical Thinking, Technical Writing, Conflict Resolution, Financial Forecasting"
IT Support Specialist,Automotive,"Change Management, Sales Negotiation, Marketing Strategy, Design Thinking, Coding"
IT Support Specialist,Pharmaceutical,"Machine Learning, Cybersecurity Protocols, Public Speaking, Coding, Stakeholder Management"
IT Support Specialist,Tourism,"Quality Assurance, Quality Assurance, Conflict Resolution, Risk Assessment, Coding"
IT Support Specialist,Hospitality,"Marketing Strategy, Stakeholder Management, Collaboration, Coding, Process Optimization"
Legal Consultant,Automotive,"Marketing Strategy, Process Optimization, Sales Negotiation, Media Planning, Energy Efficiency"
Legal Consultant,Aerospace,"Marketing Strategy, Risk Assessment, System Architecture, Technical Writing, Customer Relationship Management"
Legal Consultant,Fashion,"Product Roadmapping, Quality Assurance, AI Development, Employee Engagement, Transportation Logistics"
Legal Consultant,Nonprofit,"Collaboration, Project Management, Technical Writing, Transportation Logistics, Product Roadmapping"
Legal Consultant,Consulting,"Stakeholder Management, Product Roadmapping, Quality Assurance, SEO Optimization, Database Management"
Legal Consultant,Real Estate,"Media Planning, Public Speaking, Creativity, Marketing Strategy, Project Management"
Legal Consultant,Agriculture,"Risk Assessment, Cloud Computing, Design Thinking, Creativity, Change Management"
Legal Consultant,Hospitality,"Creativity, User Research, Machine Learning, Problem Solving, Regulatory Compliance"
Legal Consultant,Tourism,"Data Analysis, Sales Negotiation, Database Management, Regulatory Compliance, Networking"
Legal Consultant,Pharmaceutical,"SEO Optimization, Cybersecurity Protocols, Financial Forecasting, Creativity, AI Development"
Logistics Coordinator,Tourism,"Team Leadership, Machine Learning, Budgeting, Employee Engagement, Regulatory Compliance"
Logistics Coordinator,Automotive,"Database Management, Media Planning, System Architecture, Media Planning, Database Management"
Logistics Coordinator,Agriculture,"Technical Writing, Cybersecurity Protocols, Cloud Computing, Change Management, Product Roadmapping"
Logistics Coordinator,Real Estate,"Energy Efficiency, Project Management, Design Thinking, Creativity, Data Visualization"
Logistics Coordinator,Consulting,"Market Research, Critical Thinking, Team Leadership, Marketing Strategy, Collaboration"
Logistics Coordinator,Pharmaceutical,"Data Analysis, Adaptability, Risk Assessment, Creativity, Adaptability"
Logistics Coordinator,Nonprofit,"Marketing Strategy, Machine Learning, Machine Learning, Content Creation, Supply Chain Management"
Logistics Coordinator,Fashion,"Supply Chain Management, Adaptability, Risk Assessment, Energy Efficiency, Cybersecurity Protocols"
Logistics Coordinator,Aerospace,"User Research, Collaboration, Regulatory Compliance, Networking, Cloud Computing"
Logistics Coordinator,Hospitality,"Marketing Strategy, Networking, Financial Forecasting, Technical Writing, Cloud Computing"
Marketing Specialist,Energy,"Problem Solving, Conflict Resolution, Energy Efficiency, Creativity, Regulatory Compliance"
Marketing Specialist,Technology,"Data Analysis, Critical Thinking, Product Roadmapping, Product Roadmapping, Financial Forecasting"
Marketing Specialist,Retail,"Risk Assessment, Quality Assurance, Creativity, Content Creation, System Architecture"
Marketing Specialist,Education,"Supply Chain Management, Design Thinking, Networking, Sales Negotiation, Problem Solving"
Marketing Specialist,Finance,"Content Creation, Coding, Risk Assessment, Supply Chain Management, Technical Writing"
Marketing Specialist,Transportation,"Statistical Modeling, Data Analysis, Product Roadmapping, Process Optimization, Collaboration"
Marketing Specialist,Telecommunications,"Networking, Change Management, Quality Assurance, Statistical Modeling, Adaptability"
Marketing Specialist,Manufacturing,"Machine Learning, Design Thinking, Networking, Employee Engagement, Critical Thinking"
Marketing Specialist,Entertainment,"Quality Assurance, Financial Forecasting, Healthcare Compliance, Adaptability, Supply Chain Management"
Marketing Specialist,Healthcare,"Collaboration, System Architecture, Product Roadmapping, Product Roadmapping, Energy Efficiency"
Operations Manager,Education,"Media Planning, Cybersecurity Protocols, Content Creation, Project Management, Coding"
Operations Manager,Technology,"Regulatory Compliance, Networking, Risk Assessment, Content Creation, Media Planning"
Operations Manager,Retail,"Statistical Modeling, Employee Engagement, Database Management, Communication, Process Optimization"
Operations Manager,Finance,"Networking, Project Management, Project Management, Customer Relationship Management, Change Management"
Operations Manager,Transportation,"Quality Assurance, User Research, Project Management, Quality Assurance, Team Leadership"
Operations Manager,Telecommunications,"Technical Writing, Design Thinking, Quality Assurance, Marketing Strategy, Machine Learning"
Operations Manager,Manufacturing,"Design Thinking, Marketing Strategy, Public Speaking, Adaptability, Energy Efficiency"
Operations Manager,Entertainment,"Media Planning, Database Management, Energy Efficiency, Machine Learning, User Research"
Operations Manager,Healthcare,"Media Planning, Public Speaking, Supply Chain Management, Market Research, Media Planning"
Operations Manager,Energy,"Energy Efficiency, Quality Assurance, Risk Assessment, Energy Efficiency, Coding"
Product Manager,Entertainment,"Cloud Computing, Adaptability, Employee Engagement, AI Development, Stakeholder Management"
Product Manager,Energy,"Team Leadership, Media Planning, Employee Engagement, Financial Forecasting, Project Management"
Product Manager,Healthcare,"Collaboration, Project Management, Customer Relationship Management, Cloud Computing, Risk Assessment"
Product Manager,Manufacturing,"Networking, Risk Assessment, Risk Assessment, Content Creation, Data Visualization"
Product Manager,Telecommunications,"Database Management, Machine Learning, Networking, Regulatory Compliance, Stakeholder Management"
Product Manager,Transportation,"Budgeting, Networking, Healthcare Compliance, Quality Assurance, Conflict Resolution"
Product Manager,Education,"SEO Optimization, Problem Solving, Healthcare Compliance, Cloud Computing, Process Optimization"
Product Manager,Retail,"Healthcare Compliance, Technical Writing, Employee Engagement, Budgeting, Supply Chain Management"
Product Manager,Technology,"Transportation Logistics, Team Leadership, Process Optimization, Adaptability, AI Development"
Product Manager,Finance,"Market Research, Public Speaking, Market Research, Employee Engagement, Data Visualization"
Sales Manager,Healthcare,"Machine Learning, Machine Learning, Public Speaking, Process Optimization, Media Planning"
Sales Manager,Energy,"Problem Solving, Public Speaking, Budgeting, Adaptability, SEO Optimization"
Sales Manager,Technology,"Team Leadership, AI Development, System Architecture, Statistical Modeling, Coding"
Sales Manager,Retail,"Networking, Public Speaking, Budgeting, Data Analysis, Creativity"
Sales Manager,Education,"AI Development, Cybersecurity Protocols, User Research, Networking, Budgeting"
Sales Manager,Entertainment,"User Research, System Architecture, Energy Efficiency, Design Thinking, Sales Negotiation"
Sales Manager,Transportation,"Marketing Strategy, Media Planning, Data Analysis, Collaboration, Regulatory Compliance"
Sales Manager,Telecommunications,"Media Planning, Marketing Strategy, Financial Forecasting, Public Speaking, Team Leadership"
Sales Manager,Manufacturing,"Transportation Logistics, Coding, Marketing Strategy, Networking, Change Management"
Sales Manager,Finance,"Process Optimization, System Architecture, Data Visualization, User Research, Data Visualization"
Social Media Manager,Pharmaceutical,"Cybersecurity Protocols, Transportation Logistics, Financial Forecasting, Communication, Customer Relationship Management"
Social Media Manager,Hospitality,"Regulatory Compliance, Communication, Design Thinking, Risk Assessment, Supply Chain Management"
Social Media Manager,Agriculture,"Cloud Computing, Team Leadership, Cybersecurity Protocols, Marketing Strategy, Healthcare Compliance"
Social Media Manager,Real Estate,"Sales Negotiation, Critical Thinking, Cloud Computing, Networking, Cloud Computing"
Social Media Manager,Consulting,"Supply Chain Management, Conflict Resolution, Team Leadership, Critical Thinking, Public Speaking"
Social Media Manager,Nonprofit,"Team Leadership, AI Development, Media Planning, Design Thinking, Machine Learning"
Social Media Manager,Fashion,"Public Speaking, Database Management, User Research, Communication, Adaptability"
Social Media Manager,Aerospace,"SEO Optimization, Networking, Transportation Logistics, Change Management, Risk Assessment"
Social Media Manager,Automotive,"Employee Engagement, Problem Solving, Process Optimization, Problem Solving, Financial Forecasting"
Social Media Manager,Tourism,"Energy Efficiency, Budgeting, Collaboration, Creativity, Quality Assurance"
Software Engineer,Finance,"Financial Forecasting, Change Management, Coding, Healthcare Compliance, AI Development"
Software Engineer,Healthcare,"Database Management, Energy Efficiency, Customer Relationship Management, Cybersecurity Protocols, Critical Thinking"
Software Engineer,Manufacturing,"Transportation Logistics, Adaptability, Data Analysis, Supply Chain Management, Creativity"
Software Engineer,Telecommunications,"User Research, User Research, Employee Engagement, Team Leadership, Marketing Strategy"
Software Engineer,Transportation,"Change Management, Design Thinking, Stakeholder Management, Cybersecurity Protocols, Media Planning"
Software Engineer,Education,"Collaboration, Cloud Computing, Design Thinking, Database Management, Marketing Strategy"
Software Engineer,Retail,"Project Management, Cloud Computing, Design Thinking, Problem Solving, Customer Relationship Management"
Software Engineer,Technology,"Public Speaking, Creativity, Employee Engagement, User Research, Budgeting"
Software Engineer,Entertainment,"Change Management, Budgeting, Media Planning, Data Visualization, Content Creation"
Software Engineer,Energy,"Team Leadership, Change Management, Risk Assessment, Stakeholder Management, Transportation Logistics"
UX Designer,Manufacturing,"Data Visualization, Coding, Transportation Logistics, Media Planning, Design Thinking"
UX Designer,Telecommunications,"Networking, Supply Chain Management, Quality Assurance, Machine Learning, Adaptability"
UX Designer,Transportation,"Adaptability, Market Research, Cybersecurity Protocols, Customer Relationship Management, Quality Assurance"
UX Designer,Finance,"Technical Writing, Quality Assurance, Team Leadership, Transportation Logistics, Networking"
UX Designer,Entertainment,"Customer Relationship Management, Machine Learning, Employee Engagement, Risk Assessment, Budgeting"
UX Designer,Retail,"Cybersecurity Protocols, Technical Writing, Quality Assurance, Problem Solving, Machine Learning"
UX Designer,Technology,"Content Creation, Quality Assurance, Media Planning, Collaboration, Database Management"
UX Designer,Energy,"Technical Writing, Team Leadership, Coding, Database Management, Conflict Resolution"
UX Designer,Education,"Customer Relationship Management, Employee Engagement, Stakeholder Management, Sales Negotiation, Data Visualization"
UX Designer,Healthcare,"Supply Chain Management, Risk Assessment, Market Research, Critical Thinking, Healthcare Compliance"
